{
  "language": "ba",
  "course_type": "general",
  "level": "C1",
  "units": [
    {
      "unit": 1,
      "title": "Фән, технология һәм йәмғиәт",
      "lessons": [
        {
          "lesson": 1,
          "type": "vocab",
          "title": "Фән, технология һәм йәмғиәт - Vocabulary I",
          "duration_minutes": 60,
          "vocabulary": [
            "C1 terminology"
          ],
          "teacher_notes": "Focus on advanced фән, технология һәм йәмғиәт vocabulary and registers.",
          "recycled": "Foundational communication & basic level vocabulary"
        },
        {
          "lesson": 2,
          "type": "grammar",
          "title": "Фән, технология һәм йәмғиәт - Advanced Grammar",
          "duration_minutes": 60,
          "grammar": [
            "Complex structures"
          ],
          "teacher_notes": "Focus on stylistic inversion and advanced connectors.",
          "recycled": "C1 terminology"
        },
        {
          "lesson": 3,
          "type": "spoken",
          "title": "Фән, технология һәм йәмғиәт - Seminar & Debate",
          "duration_minutes": 90,
          "teacher_notes": "Critical discussion and presentation skills.",
          "recycled": "Complex structures, C1 terminology"
        }
      ]
    },
    {
      "unit": 2,
      "title": "Хакимиәт һәм институттар",
      "lessons": [
        {
          "lesson": 1,
          "type": "vocab",
          "title": "Хакимиәт һәм институттар - Vocabulary I",
          "duration_minutes": 60,
          "vocabulary": [
            "C1 terminology"
          ],
          "teacher_notes": "Focus on advanced хакимиәт һәм институттар vocabulary and registers.",
          "recycled": "Complex structures, C1 terminology"
        },
        {
          "lesson": 2,
          "type": "grammar",
          "title": "Хакимиәт һәм институттар - Advanced Grammar",
          "duration_minutes": 60,
          "grammar": [
            "Complex structures"
          ],
          "teacher_notes": "Focus on stylistic inversion and advanced connectors.",
          "recycled": "Complex structures, C1 terminology, C1 terminology"
        },
        {
          "lesson": 3,
          "type": "spoken",
          "title": "Хакимиәт һәм институттар - Seminar & Debate",
          "duration_minutes": 90,
          "teacher_notes": "Critical discussion and presentation skills.",
          "recycled": "Complex structures, Complex structures, C1 terminology"
        }
      ]
    },
    {
      "unit": 3,
      "title": "Социаль структуралар",
      "lessons": [
        {
          "lesson": 1,
          "type": "vocab",
          "title": "Социаль структуралар - Vocabulary I",
          "duration_minutes": 60,
          "vocabulary": [
            "C1 terminology"
          ],
          "teacher_notes": "Focus on advanced социаль структуралар vocabulary and registers.",
          "recycled": "Complex structures, Complex structures, C1 terminology"
        },
        {
          "lesson": 2,
          "type": "grammar",
          "title": "Социаль структуралар - Advanced Grammar",
          "duration_minutes": 60,
          "grammar": [
            "Complex structures"
          ],
          "teacher_notes": "Focus on stylistic inversion and advanced connectors.",
          "recycled": "Complex structures, Complex structures, C1 terminology"
        },
        {
          "lesson": 3,
          "type": "spoken",
          "title": "Социаль структуралар - Seminar & Debate",
          "duration_minutes": 90,
          "teacher_notes": "Critical discussion and presentation skills.",
          "recycled": "Complex structures, Complex structures, C1 terminology"
        }
      ]
    },
    {
      "unit": 4,
      "title": "Белем һәм хаҡлыҡ",
      "lessons": [
        {
          "lesson": 1,
          "type": "vocab",
          "title": "Белем һәм хаҡлыҡ - Vocabulary I",
          "duration_minutes": 60,
          "vocabulary": [
            "C1 terminology"
          ],
          "teacher_notes": "Focus on advanced белем һәм хаҡлыҡ vocabulary and registers.",
          "recycled": "Complex structures, Complex structures, C1 terminology"
        },
        {
          "lesson": 2,
          "type": "grammar",
          "title": "Белем һәм хаҡлыҡ - Advanced Grammar",
          "duration_minutes": 60,
          "grammar": [
            "Complex structures"
          ],
          "teacher_notes": "Focus on stylistic inversion and advanced connectors.",
          "recycled": "Complex structures, Complex structures, C1 terminology"
        },
        {
          "lesson": 3,
          "type": "spoken",
          "title": "Белем һәм хаҡлыҡ - Seminar & Debate",
          "duration_minutes": 90,
          "teacher_notes": "Critical discussion and presentation skills.",
          "recycled": "Complex structures, Complex structures, C1 terminology"
        }
      ]
    },
    {
      "unit": 5,
      "title": "Дискурс һәм аргументация",
      "lessons": [
        {
          "lesson": 1,
          "type": "vocab",
          "title": "Дискурс һәм аргументация - Vocabulary I",
          "duration_minutes": 60,
          "vocabulary": [
            "C1 terminology"
          ],
          "teacher_notes": "Focus on advanced дискурс һәм аргументация vocabulary and registers.",
          "recycled": "Complex structures, Complex structures, C1 terminology"
        },
        {
          "lesson": 2,
          "type": "grammar",
          "title": "Дискурс һәм аргументация - Advanced Grammar",
          "duration_minutes": 60,
          "grammar": [
            "Complex structures"
          ],
          "teacher_notes": "Focus on stylistic inversion and advanced connectors.",
          "recycled": "Complex structures, Complex structures, C1 terminology"
        },
        {
          "lesson": 3,
          "type": "spoken",
          "title": "Дискурс һәм аргументация - Seminar & Debate",
          "duration_minutes": 90,
          "teacher_notes": "Critical discussion and presentation skills.",
          "recycled": "Complex structures, Complex structures, C1 terminology"
        }
      ]
    }
  ]
}
