{
  "language": "hy",
  "course_type": "general",
  "level": "C1",
  "units": [
    {
      "unit": 1,
      "title": "Գիտություն, տեխնիկա և հասարակություն",
      "lessons": [
        {
          "lesson": 1,
          "type": "vocab",
          "title": "Գիտություն, տեխնիկա և հասարակություն - Vocabulary I",
          "duration_minutes": 60,
          "vocabulary": [
            "C1 terminology"
          ],
          "teacher_notes": "Focus on advanced գիտություն, տեխնիկա և հասարակություն vocabulary and registers."
        },
        {
          "lesson": 2,
          "type": "grammar",
          "title": "Գիտություն, տեխնիկա և հասարակություն - Advanced Grammar",
          "duration_minutes": 60,
          "grammar": [
            "Complex structures"
          ],
          "teacher_notes": "Focus on stylistic inversion and advanced connectors."
        },
        {
          "lesson": 3,
          "type": "spoken",
          "title": "Գիտություն, տեխնիկա և հասարակություն - Seminar & Debate",
          "duration_minutes": 90,
          "teacher_notes": "Critical discussion and presentation skills."
        }
      ]
    },
    {
      "unit": 2,
      "title": "Իշխանություն և ինստիտուտներ",
      "lessons": [
        {
          "lesson": 1,
          "type": "vocab",
          "title": "Իշխանություն և ինստիտուտներ - Vocabulary I",
          "duration_minutes": 60,
          "vocabulary": [
            "C1 terminology"
          ],
          "teacher_notes": "Focus on advanced իշխանություն և ինստիտուտներ vocabulary and registers."
        },
        {
          "lesson": 2,
          "type": "grammar",
          "title": "Իշխանություն և ինստիտուտներ - Advanced Grammar",
          "duration_minutes": 60,
          "grammar": [
            "Complex structures"
          ],
          "teacher_notes": "Focus on stylistic inversion and advanced connectors."
        },
        {
          "lesson": 3,
          "type": "spoken",
          "title": "Իշխանություն և ինստիտուտներ - Seminar & Debate",
          "duration_minutes": 90,
          "teacher_notes": "Critical discussion and presentation skills."
        }
      ]
    },
    {
      "unit": 3,
      "title": "Սոցիալական կառուցվածքներ",
      "lessons": [
        {
          "lesson": 1,
          "type": "vocab",
          "title": "Սոցիալական կառուցվածքներ - Vocabulary I",
          "duration_minutes": 60,
          "vocabulary": [
            "C1 terminology"
          ],
          "teacher_notes": "Focus on advanced սոցիալական կառուցվածքներ vocabulary and registers."
        },
        {
          "lesson": 2,
          "type": "grammar",
          "title": "Սոցիալական կառուցվածքներ - Advanced Grammar",
          "duration_minutes": 60,
          "grammar": [
            "Complex structures"
          ],
          "teacher_notes": "Focus on stylistic inversion and advanced connectors."
        },
        {
          "lesson": 3,
          "type": "spoken",
          "title": "Սոցիալական կառուցվածքներ - Seminar & Debate",
          "duration_minutes": 90,
          "teacher_notes": "Critical discussion and presentation skills."
        }
      ]
    },
    {
      "unit": 4,
      "title": "Գիտելիք և ճշմարտություն",
      "lessons": [
        {
          "lesson": 1,
          "type": "vocab",
          "title": "Գիտելիք և ճշմարտություն - Vocabulary I",
          "duration_minutes": 60,
          "vocabulary": [
            "C1 terminology"
          ],
          "teacher_notes": "Focus on advanced գիտելիք և ճշմարտություն vocabulary and registers."
        },
        {
          "lesson": 2,
          "type": "grammar",
          "title": "Գիտելիք և ճշմարտություն - Advanced Grammar",
          "duration_minutes": 60,
          "grammar": [
            "Complex structures"
          ],
          "teacher_notes": "Focus on stylistic inversion and advanced connectors."
        },
        {
          "lesson": 3,
          "type": "spoken",
          "title": "Գիտելիք և ճշմարտություն - Seminar & Debate",
          "duration_minutes": 90,
          "teacher_notes": "Critical discussion and presentation skills."
        }
      ]
    },
    {
      "unit": 5,
      "title": "Դիսկուրս և փաստարկում",
      "lessons": [
        {
          "lesson": 1,
          "type": "vocab",
          "title": "Դիսկուրս և փաստարկում - Vocabulary I",
          "duration_minutes": 60,
          "vocabulary": [
            "C1 terminology"
          ],
          "teacher_notes": "Focus on advanced դիսկուրս և փաստարկում vocabulary and registers."
        },
        {
          "lesson": 2,
          "type": "grammar",
          "title": "Դիսկուրս և փաստարկում - Advanced Grammar",
          "duration_minutes": 60,
          "grammar": [
            "Complex structures"
          ],
          "teacher_notes": "Focus on stylistic inversion and advanced connectors."
        },
        {
          "lesson": 3,
          "type": "spoken",
          "title": "Դիսկուրս և փաստարկում - Seminar & Debate",
          "duration_minutes": 90,
          "teacher_notes": "Critical discussion and presentation skills."
        }
      ]
    }
  ]
}
