{
  "language": "el",
  "course_type": "general",
  "level": "C1",
  "units": [
    {
      "unit": 1,
      "title": "Ενότητα 1: Κριτική ανάλυση και επίσημο ύφος",
      "lessons": [
        {
          "lesson": 1,
          "title": "Λόγιες συντακτικές δομές και μετοχικοί σχηματισμοί",
          "grammar": ["Χρήση λόγιων μετοχών (παρόντος, παρελθόντος)"],
          "vocabulary": ["Οξυδέρκεια", "Ευγλωττία", "Υπονοούμενο", "Προϋπόθεση", "Ουσία"],
          "teacher_notes": "code: \"EL-C1-001\"\ncando: \"Μπορεί να εκφραστεί με άνεση σε επίσημο και απαιτητικό ύφος\""
        }
      ]
    }
  ]
}
