{
  "language": "el",
  "course_type": "general",
  "level": "C2",
  "units": [
    {
      "unit": 1,
      "title": "Ενότητα 1: Υφολογική κατάκτηση και πολιτισμικές λεπτότητες",
      "lessons": [
        {
          "lesson": 1,
          "title": "Ρητορική και λόγιος λόγος",
          "grammar": ["Συντακτική αναστροφή και υφολογικές επιλογές"],
          "vocabulary": ["Πολυμάθεια", "Αλληγορία", "Αφορισμός", "Πεμπτουσία", "Μεταφορά"],
          "teacher_notes": "code: \"EL-C2-001\"\ncando: \"Κατέχει όλες τις υφολογικές και πολιτισμικές λεπτότητες της ελληνικής γλώσσας σε επίπεδο φυσικού ομιλητή\""
        }
      ]
    }
  ]
}
