{
  "language": "ru",
  "course_type": "general",
  "level": "B1",
  "units": [
    {
      "unit": 1,
      "title": "Раздел 1: Выражение мнения и дискуссия",
      "lessons": [
        {
          "lesson": 1,
          "title": "Сложноподчиненные предложения (потому что, так как, хотя)",
          "grammar": ["Союзы причины и уступки"],
          "vocabulary": ["По моему мнению", "С одной стороны", "Следствие", "Причина", "Аргумент"],
          "teacher_notes": "code: \"RU-B1-001\"\ncando: \"Может аргументированно выразить свое мнение\""
        }
      ]
    }
  ]
}
